{
  "schema": {
    "id": "activity-catalog",
    "version": "v0.2"
  },
  "source": {
    "kind": "nuget-package",
    "id": "UiPath.DesktopTriggers.Activities",
    "version": "1.0.4",
    "feedUrl": null,
    "authors": "UiPath",
    "projectUrl": "https://docs.uipath.com/activities/docs/about-the-desktop-triggers-activities-pack",
    "description": "Monitors system or application specific performance (CPU, Memory, Disk,Network)/resource utilization to perform actions based on designated resource consumption thresholds",
    "license": "https://www.uipath.com/hubfs/legalspot/UiPath_MSSA.pdf",
    "tags": "UiPathActivities,Triggers,Performance",
    "packageTypes": []
  },
  "generatedAt": "2026-04-09T21:48:08Z",
  "activities": [],
  "enums": [
    {
      "fullName": "UiPath.DesktopTriggers.Activities.Helpers.CounterType",
      "underlyingType": "System.Int32",
      "members": [
        {
          "name": "Memory",
          "value": 0
        },
        {
          "name": "CPU",
          "value": 1
        },
        {
          "name": "Disk",
          "value": 2
        },
        {
          "name": "Network",
          "value": 3
        }
      ]
    }
  ],
  "namespaceMappings": []
}
