{
  "schema": {
    "id": "activity-catalog",
    "version": "v0.2"
  },
  "source": {
    "kind": "nuget-package",
    "id": "UiPath.Credentials.Activities",
    "version": "3.0.0",
    "feedUrl": null,
    "authors": "UiPath",
    "projectUrl": null,
    "description": "UiPath Credentials Activities Pack",
    "license": "https://docs.uipath.com/activities/docs/about-the-credentials-activities-pack",
    "tags": "UiPathActivities",
    "packageTypes": []
  },
  "generatedAt": "2026-04-09T21:47:58Z",
  "activities": [
    {
      "id": "UiPath.Credentials.Activities.AddCredential@UiPath.Credentials.Activities/3.0.0",
      "fullName": "UiPath.Credentials.Activities.AddCredential",
      "displayName": "Add Credentials",
      "description": "Add Credentials",
      "category": null,
      "visibility": "browsable",
      "hasGenericParameters": false,
      "genericParameterNames": [],
      "members": [
        {
          "name": "Username",
          "displayName": "Username",
          "dataType": "System.Activities.InArgument<System.String>",
          "memberKind": "argument",
          "argumentDirection": "in",
          "isRequiredArgument": true,
          "description": null,
          "category": null,
          "defaultValue": null,
          "typeConverter": null
        },
        {
          "name": "Password",
          "displayName": "Password",
          "dataType": "System.Activities.InArgument<System.String>",
          "memberKind": "argument",
          "argumentDirection": "in",
          "isRequiredArgument": false,
          "description": null,
          "category": null,
          "defaultValue": null,
          "typeConverter": null
        },
        {
          "name": "PasswordSecureString",
          "displayName": "PasswordSecureString",
          "dataType": "System.Activities.InArgument<System.Security.SecureString>",
          "memberKind": "argument",
          "argumentDirection": "in",
          "isRequiredArgument": false,
          "description": null,
          "category": null,
          "defaultValue": null,
          "typeConverter": null
        },
        {
          "name": "Target",
          "displayName": "Target",
          "dataType": "System.Activities.InArgument<System.String>",
          "memberKind": "argument",
          "argumentDirection": "in",
          "isRequiredArgument": true,
          "description": null,
          "category": null,
          "defaultValue": null,
          "typeConverter": null
        },
        {
          "name": "CredentialType",
          "displayName": "CredentialType",
          "dataType": "CredentialManagement.CredentialType",
          "memberKind": "property",
          "argumentDirection": null,
          "isRequiredArgument": false,
          "description": null,
          "category": null,
          "defaultValue": null,
          "typeConverter": null
        },
        {
          "name": "PersistanceType",
          "displayName": "PersistanceType",
          "dataType": "CredentialManagement.PersistanceType",
          "memberKind": "property",
          "argumentDirection": null,
          "isRequiredArgument": false,
          "description": null,
          "category": null,
          "defaultValue": null,
          "typeConverter": null
        }
      ],
      "enrichment": null
    },
    {
      "id": "UiPath.Credentials.Activities.DeleteCredential@UiPath.Credentials.Activities/3.0.0",
      "fullName": "UiPath.Credentials.Activities.DeleteCredential",
      "displayName": "Delete Credentials",
      "description": "Delete Credentials",
      "category": null,
      "visibility": "browsable",
      "hasGenericParameters": false,
      "genericParameterNames": [],
      "members": [
        {
          "name": "Target",
          "displayName": "Target",
          "dataType": "System.Activities.InArgument<System.String>",
          "memberKind": "argument",
          "argumentDirection": "in",
          "isRequiredArgument": true,
          "description": null,
          "category": null,
          "defaultValue": null,
          "typeConverter": null
        }
      ],
      "enrichment": null
    },
    {
      "id": "UiPath.Credentials.Activities.GetSecureCredential@UiPath.Credentials.Activities/3.0.0",
      "fullName": "UiPath.Credentials.Activities.GetSecureCredential",
      "displayName": "Get Secure Credentials",
      "description": "Get Secure Credentials",
      "category": null,
      "visibility": "browsable",
      "hasGenericParameters": false,
      "genericParameterNames": [],
      "members": [
        {
          "name": "Target",
          "displayName": "Target",
          "dataType": "System.Activities.InArgument<System.String>",
          "memberKind": "argument",
          "argumentDirection": "in",
          "isRequiredArgument": true,
          "description": null,
          "category": null,
          "defaultValue": null,
          "typeConverter": null
        },
        {
          "name": "CredentialType",
          "displayName": "CredentialType",
          "dataType": "CredentialManagement.CredentialType",
          "memberKind": "property",
          "argumentDirection": null,
          "isRequiredArgument": false,
          "description": null,
          "category": null,
          "defaultValue": null,
          "typeConverter": null
        },
        {
          "name": "PersistanceType",
          "displayName": "PersistanceType",
          "dataType": "CredentialManagement.PersistanceType",
          "memberKind": "property",
          "argumentDirection": null,
          "isRequiredArgument": false,
          "description": null,
          "category": null,
          "defaultValue": null,
          "typeConverter": null
        },
        {
          "name": "Username",
          "displayName": "Username",
          "dataType": "System.Activities.OutArgument<System.String>",
          "memberKind": "argument",
          "argumentDirection": "out",
          "isRequiredArgument": false,
          "description": null,
          "category": null,
          "defaultValue": null,
          "typeConverter": null
        },
        {
          "name": "Password",
          "displayName": "Password",
          "dataType": "System.Activities.OutArgument<System.Security.SecureString>",
          "memberKind": "argument",
          "argumentDirection": "out",
          "isRequiredArgument": false,
          "description": null,
          "category": null,
          "defaultValue": null,
          "typeConverter": null
        }
      ],
      "enrichment": null
    },
    {
      "id": "UiPath.Credentials.Activities.RequestCredential@UiPath.Credentials.Activities/3.0.0",
      "fullName": "UiPath.Credentials.Activities.RequestCredential",
      "displayName": "Request Credentials",
      "description": "Request Credentials",
      "category": null,
      "visibility": "browsable",
      "hasGenericParameters": false,
      "genericParameterNames": [],
      "members": [
        {
          "name": "Message",
          "displayName": "Message",
          "dataType": "System.Activities.InArgument<System.String>",
          "memberKind": "argument",
          "argumentDirection": "in",
          "isRequiredArgument": false,
          "description": null,
          "category": null,
          "defaultValue": null,
          "typeConverter": null
        },
        {
          "name": "Title",
          "displayName": "Title",
          "dataType": "System.Activities.InArgument<System.String>",
          "memberKind": "argument",
          "argumentDirection": "in",
          "isRequiredArgument": false,
          "description": null,
          "category": null,
          "defaultValue": null,
          "typeConverter": null
        },
        {
          "name": "Username",
          "displayName": "Username",
          "dataType": "System.Activities.OutArgument<System.String>",
          "memberKind": "argument",
          "argumentDirection": "out",
          "isRequiredArgument": false,
          "description": null,
          "category": null,
          "defaultValue": null,
          "typeConverter": null
        },
        {
          "name": "Password",
          "displayName": "Password",
          "dataType": "System.Activities.OutArgument<System.String>",
          "memberKind": "argument",
          "argumentDirection": "out",
          "isRequiredArgument": false,
          "description": null,
          "category": null,
          "defaultValue": null,
          "typeConverter": null
        },
        {
          "name": "PasswordSecureString",
          "displayName": "PasswordSecureString",
          "dataType": "System.Activities.OutArgument<System.Security.SecureString>",
          "memberKind": "argument",
          "argumentDirection": "out",
          "isRequiredArgument": false,
          "description": null,
          "category": null,
          "defaultValue": null,
          "typeConverter": null
        }
      ],
      "enrichment": null
    }
  ],
  "enums": [],
  "namespaceMappings": []
}
